TourID,FacilityID,TourName,TourType,TourDescription,TourDuration,TourAccessible,CreatedDate,LastUpdatedDate
256,251898,Family Tour (13 and up),Cave Tour,"After passing through the Spider Web Gate, your guide will give you a brief history of Crystal Cave and point out unique features and formations.  You will then be led from room to room on a paved, lighted pathways, pausing to listen to water and echoes of the cave in total darkness",50,false,2016-12-15,2018-06-14
257,251898,Life on Other Worlds,Cave Tour,Come celebrate the night skies with us!  During Sequoia and Kings Canyon annual Dark Sky Festival we will be hosting special cave programs at Crystal Cave.  Did you ever wonder if there really is a possibility of Life on Other Worlds?  Does the answer lie in caves?  Come and see us during the Dark Sky Festival and find out! ,50,false,2016-12-15,2018-06-14
258,234787,Dances of the Ancients - 9:30 am,Historic Tour,Dances of the Ancients,120,false,2017-02-02,2018-06-14
259,234787,Partial Eclipse of the Sun,Historic Tour,Partial Eclipse of the Sun - Special One-Time Event for 2017 ONLY,165,false,2017-02-02,2018-06-14
26,233373,Santiam Wagon Road - Snow Creek to House Rock,Historic Tour,Explore what early travel was like in the forest on the historic toll road that once linked the Willamette Valley to eastern Oregon. Hike is mostly downhill.,480,false,2014-05-02,2018-06-14
260,234787,Early Tour & Dances of the Ancients Package 8:30 am,Combo Tour,"This combination package begins at the upper parking lot with a one-hour guided tour of the Pueblo Trail.  You will see several unexcavated sites along the way to the Great House Pueblo, with awe-inspiring views of the San Juan Mountains and the two pinnacles. This moderately-challenging unimproved trail has a 200-foot elevation gain and exposure to heights and steep drop-offs. Parents are asked to closely supervise their children for the safety of all attendees. </p>",0,false,2017-02-23,2018-06-14
261,251937,Gold Rush 101 Historic District Walking Tour,Historic Tour,"Weekdays at 9:00, 11:00, and 3:00. Rangers reveal characters and stories of Skagways early days. Explore the heart of the National Historic District with 2-3 stops outside colorful, gold rush buildings. All tours cover the basics of the gold rush story. All tours end at the Moore Homestead Museum for a free look inside a restored frontier family home. Check out a <a href=https://www.nps.gov/klgo/planyourvisit/walking-tours.htm>video of walking tour highlights</a>.",45,true,2017-02-23,2018-06-14
262,251937,Untold Stories: Buffalo Soldiers Historic District Walking Tour,Historic Tour,"Men of the 24th Infantry - an all African American unit - maintained law and order in frontier Skagway. They served as the communitys emergency response unit and border patrol. Yet, they sparked controversy when they joined Alaskas first Young Mens Christian Association (Y.M.C.A.). Join a ranger to explore the Buffalo Soldiers contributions to Skagways past on this four block stroll of the historic district.",45,true,2017-02-23,2018-06-14
263,255304,"Leaving from Gatlinburg, TN",Nature Tour,"Buses will pick visitors up from designated parking lots in Gatlinburg, TN and will drop them off at Clingmans Dome for the event. Buses will return visitors to Gatlinburg at the end of the day.",0,true,2017-02-23,2018-06-14
264,255304,"Leaving from Cherokee, NC",Nature Tour,"Buses will pick visitors up from designated parking lots in Cherokee, NC and will drop them off at Clingmans Dome for the event.  Buses will return visitors to Cherokee at the end of the day.",0,true,2017-02-23,2018-06-14
265,234787,Dances of the Ancients - 12:30 pm,Historic Tour,Dances of the Ancients,0,false,2017-03-16,2018-06-14
266,234787,Early Tour - 8:30 am,Historic Tour,"If youve never been to Chimney Rock National Monument, take this opportunity to learn more about the people who lived in this wondrous site 1,000 years ago. Youll walk the one-third-mile Great Kiva Trail with a tour guide, and then climb the Pueblo Trail in time for the full moon program.  Guests will see a 44-foot diameter excavated great kiva on this early tour. Also on this easy trail, theres an excavated pit house, a typical residence of the ancient ones. This is a $5 add-on to the other program and tickets are non-refundable, rain or shine.",60,false,2017-03-16,2018-06-14
267,234787,Early Tour - 11:30 am,Historic Tour,"If youve never been to Chimney Rock National Monument, take this opportunity to learn more about the people who lived in this wondrous site 1,000 years ago. Youll walk the one-third-mile Great Kiva Trail with a tour guide, and then climb the Pueblo Trail in time for the full moon program.  Guests will see a 44-foot diameter excavated great kiva on this early tour. Also on this easy trail, theres an excavated pit house, a typical residence of the ancient ones. This is a $5 add-on to the other program and tickets are non-refundable, rain or shine.",60,false,2017-03-16,2018-06-14
268,234787,Early Tour & Dances of the Ancients Package 11:30 am,Combo Tour,"This combination package begins at the upper parking lot with a one-hour guided tour of the Pueblo Trail.  You will see several unexcavated sites along the way to the Great House Pueblo, with awe-inspiring views of the San Juan Mountains and the two pinnacles. This moderately-challenging unimproved trail has a 200-foot elevation gain and exposure to heights and steep drop-offs. Parents are asked to closely supervise their children for the safety of all attendees. </p>",0,false,2017-03-16,2018-06-14
27,233373,Gordon Meadows Wildflower Hike,Nature Hike,"Enjoy a spectacular display of wildflowers, including camas and elephants-head. ",480,false,2014-05-02,2018-06-14
276,233373,CCC Annual Picnic,Nature Tour,"Join us in celebrating the successes and the stories of the Civilian Conservation Corps. This annual event at Longbow Organizational Camp is free and open to the public, we just ask you bring a potluck dish to share.  Program begins at 11:00 am. If you would like transportation, call the Sweet Home Ranger District front desk at 541-367-5168",300,true,2017-04-20,2018-06-14
277,233373,In Search of Judge Waldo,Nature Tour,"Follow in the footsteps of Oregons own John Muir, Judge JB Waldo. Travel the Old Cascades visiting his favorite campsites and fishing holes.",480,false,2017-04-20,2018-06-14
278,233373,Total Eclipse from Gordon Meadows and Huckleberry Picking,Nature Tour,"Experience the total eclipse of the sun in a beautiful mountain meadow, followed by gathering huckleberries. Eclipse glasses will be available to purchase at the Ranger District, or bring your own. Eclipse glasses will be required for this hike. Dont forget a berry container and come prepared for a day in the forest.  Bring water, lunch, and appropriate clothing.",420,false,2017-04-20,2018-06-14
279,233373,Lichens Mosses and Early Wildflowers,Nature Tour,An easy 2 mile hike to learn about the ecology and identification of the common mosses and lichens adorning our trees and forest floor while enjoying Spring wildflowers.,360,false,2017-04-20,2018-06-14
28,233373,Moon Rise on Iron Mountain ,Historic Tour,See the moon rise from the top of Iron Mountain.  Sun and moon will be rising/setting at almost the same time on this particular day.  Discover being outdoors at night.  ,480,false,2014-05-02,2018-06-14
280,233373,Big Tree Expedition,Nature Tour,Be part of our Citizen Scientist experience and record the initial listing of the Sweet Home Ranger District Big Tree inventory. We will measure very large trees and feel the heartbeat of their magnificence. Historical and botanical values will be recognized and documented. ,480,false,2017-04-20,2018-06-14
281,261701,Tour of the Carter G. Woodson Home,Historic Tour,"Tours are of the first, second, and third floors of Dr. Carter G. Woodsons home. The site is still undergoing renovation and adjoining structures are not yet completed.",30,true,2017-06-08,2018-06-14
282,261701,Group Tour of the Carter G. Woodson Home,Historic Tour,"Tours are of the first, second, and third floors of Dr. Carter G. Woodsons home. The site is still undergoing renovation and adjoining structures are not yet completed.",30,true,2017-06-08,2018-06-14
284,250795,Kayak Adventure: Truro and Provincetown,Nature Tour,Kayak Trip: Paddling Adventure: Truro and Provincetown,180,false,2017-06-15,2019-06-23
286,233266,Interagency Senior Annual Pass,Pass,Interagency Senior Annual Pass,0,false,2017-08-31,2018-06-14
287,234642,Group A,Pass,Group A,120,false,2018-01-25,2018-06-14
288,233338,Deluxe Tour,Historic Tour,"Next this Deluxe Tour provides exclusive access, via your smart phone, to the National Park Services WWII archives and videos on the attack at Pearl Harbor at each of the narrated tour stops.",180,false,2018-01-25,2018-06-14
289,233338,USS Arizona Memorial Deluxe Tour,Combo Tour,"This reservation includes a free, timed USS Arizona Memorial program ticket. This comprehensive three hour self-guided package incorporates three incredible Pearl Harbor tour experiences. ",0,false,2018-01-25,2018-06-14
29,233373,Browder Ridge,Nature Tour,Hike through an old growth forest to a wildflower-filled subalpine meadow with great views of the Cascade peaks.,480,false,2014-05-02,2018-06-14
291,234787,Geology Tour,Historic Tour,"This 1.5 hour guided tour explores local geology and its relationship to the daily lives of the ancestral Puebloans who lived at Chimney Rock.  Rock types impact structures, pottery, tools, and soil productivity; geologic processes determine the landscape, and, at Chimney Rock, play a central role in climate.  The hike up the Pueblo Trail to the Chacoan Great House may be difficult for some in terms of the steep gradient, uneven footing, and elevation. ",90,false,2018-02-08,2018-06-14
292,234787,Stories at Sunset,Historic Tour,"Gather around the Great Kiva as sunset approaches, to enjoy Native American stories told by tribal storytellers.  After the story telling, well return to the upper parking lot to enjoy the sunset.",240,true,2018-02-08,2018-06-14
295,233362,Balcony House Early Bird Tour,Cliff Dwelling Tour,"Looking for an early morning adventure? This daily, early bird tour offers benefits of a small group size, cooler temperatures, and more time in the dwelling than a regular Balcony House tour. It is also available for advance, online reservations!  <br><br>  On this 90-minute tour, you will climb a 32-foot (9.8 m) ladder, crawl through an 18-inch wide (45 cm) and 12-foot (3.7 m) long tunnel, and climb up a 60-foot (20 m) open cliff face with stone steps and two 10-foot (3 m) ladders to exit.   <br><br>  Cameras are welcome, but you must be able to carry all of your gear while keeping your hands free to climb the ladders.  <br><br>  The tour begins at the north end of the Balcony House parking lot, a 24-mile (38.6 km), 1 to 11/4 hour drive from park entrance. Meet the ranger at the benches under the shade structure at Balcony House at least 15 minutes in advance of start of tour.  <br><br>  The tour is offered daily at 8:00 am from May 27, 2018 to September 8, 2018. ",90,false,2018-02-15,2018-06-14
296,233362,Square Tower House,Cliff Dwelling Tour,"This short but strenuous hike leads to a stunning and surprisingly intimate cliff dwelling. Unusual aspects of this site include an original kiva roof and the Crows Nest, features that cannot be seen from the viewpoint on the canyon rim.<br><br>This strenuous 2-hour, 1-mile (2.6km) round-trip hike is along an unpaved, uneven trail that descends 100 feet (30 m), and includes steep drop-offs, switchbacks, climbing three ladders (the longest is 20 feet [6.1m]), and scrambling up and down boulders. Wear sturdy hiking shoes or boots, bring at least 1/2 gallon (1.8 liters) of water per person, and sun protection.<br><br>This hike may not be appropriate for young children. Each hiker must be able to scramble over boulders and navigate steep gravel trails unassisted. Please, bring no food or snacks! Archeological sites are vulnerable to damage caused by rodents attracted to crumbs and dropped snacks.",120,false,2018-02-15,2018-06-14
297,234787,Summer Sunrise,Historic Tour,Attendees rise early and watch the sun rise from two special places at Chimney Rock. ,120,false,2018-03-08,2018-06-14
298,273800,Dog Mountain Trail System Permit,Nature Tour,"The popular Dog Mountain - Augspurger Loop Trail is a strenuous 6.8-mile loop that climbs 2,828 feet. Approximate hiking time is three to six hours. The area provides opportunities for several shorter hikes as well. Visitors can expect crowded conditions along the trail on weekends during the wildflower season. ",0,false,2018-03-08,2020-02-28
299,234787,Early Tour - Stories,Historic Tour,"Prior to the Stories at Sunset program, enjoy a 1-hour guided tour of the Pueblo Trail, which takes you to the pueblo site just below the two pinnacles which give Chimney Rock its name. Be aware that this trail is unimproved and includes steep sections and sheer drop-offs with no handrails. This is a $5 add-on ($2.50 add-on for children 5-12) to the Stories at Sunset program.",60,false,2018-03-15,2018-06-14
30,233373,Iron Mountian and Cone Peak Wildflower Hike,Nature Hike,"Explore the wildflowers, panoramic views and geologic formations that surround these two landmarks. Trail is rocky and uneven in places.",480,false,2014-05-02,2018-06-14
300,234787,Early Tour & Stories at Sunset Package,Combo Tour,"Prior to the Stories at Sunset program, a guided tour of the Pueblo Trail will be offered for 25 people.",0,false,2018-03-15,2018-06-14
301,274287,Sunset Tour,Nature Tour,Watch as the sun appears to melt into the lake. Experience one of the best views of the lake at one of the most picturesque times of the day. This will be an inspiring and beautiful experience you wont soon forget.,120,false,2018-04-19,2018-06-14
302,274287,Night Sky Tour,Nature Tour,"Suppose you had a clear, moonless night. How many stars could you see with the eye alone?",210,false,2018-04-19,2018-06-14
303,233373,Paddle Board/Kayak Daly Lake with the Ranger,Nature Tour,Enjoy a day of paddling Daly Lake and conducting a biological inventory of the lake. ,240,false,2018-04-26,2018-06-14
304,233373,Horseback Ride With The Ranger,Nature Tour,Enjoy a 13 mile horseback  ride,480,false,2018-04-26,2018-06-14
305,233373,U.S. Capitol Christmas Tree Ornament Making,Nature Tour,Create your own ornament to go to Washington DC for the 2018 Capitol Christmas Tree. This will be a day spent crafting outdoors at Longbow shelter.There will be supplies provided to create three ornaments. Please feel free to bring your own medium for a project. There is no electrcity at this facility. This is a free event. To register please call the  Sweet Home Ranger District front desk. 541-367-5168,390,true,2018-04-26,2018-06-14
306,233373,Mountain Biking with the Ranger,Nature Tour,"Enjoy a 19 mile single-track mountain bike ride on the historic Santiam Wagon Road going back in time to learn about the importance of this historic route to early settlers.  The ride is rated as moderately difficult, has rolling hills, and an overall descent of 1000 feet. We will ride downhill and be picked up via shuttle at House Rock Campground.  The shuttle vehicles will take participants and their bikes back to their vehicles at Fish Lake.     ",480,false,2018-04-26,2018-06-14
307,233373,U.S. Capitol Christmas Tree Send Off,Nature Tour,Join the City of Sweet Homes celebration parade adnd send off of the U.S. Cappitol  Christmas Tree as itmakes its way along The Oregon Trail  (in reverse) to the West Lawn of the Capitol in Washington D.C.  The time for this event has not been determined.  contact ; Nikki Swanson nswanson@fs.fed.us,360,true,2018-04-26,2018-06-14
308,274313,Beat 1,Nature Tour,Beat 1,0,false,2018-04-26,2018-06-14
309,274313,Beat 2,Nature Tour,Beat 2,0,false,2018-04-26,2018-06-14
31,233373,Santiam Wagon Road - Fish Lake to Lost Prairie ,Historic Tour,Explore what early travel was like in the forest on the historic toll road that once linked the Wilamette Valley to Eastern Oregon.,480,false,2014-05-02,2018-06-14
310,274313,Beat 3,Nature Tour,Beat 3,0,false,2018-04-26,2018-06-14
311,251610,Family Cave Tour,Cave Tour,Take a journey into the underground to discover the uniqueness of Oregon Caves together as a family!,90,false,2018-05-10,2018-06-14
312,274348,Bus Parking,Pass,Bus Parking,180,true,2018-05-17,2018-06-14
313,274349,Moonlight (7:30 pm - 10:00 pm) Kayak at Oak Bottom,Nature Tour,Hop on a tandem kayak,150,false,2018-05-17,2018-06-14
314,274349,Morning (9:00 am-11:30 am) Kayak at Oak Bottom,Nature Tour,Hop on a tandem kayak,150,false,2018-05-17,2018-06-14
315,274349,Evening (5:00 pm-7:30 pm) Kayak at Oak Bottom,Nature Tour,Hop on a tandem kayak,150,false,2018-05-17,2018-06-14
316,274349,Paddle Board at Brandy Creek (1:30 PM- 3:30 PM),Nature Tour,Designed for those with little or no previous experinece on a paddle board,120,false,2018-05-17,2018-06-14
32,233373,Early Mountain Wildflowers and Late Lichens and Mosses,Nature Hike,"See the first flowers to appear once the snow melts, followed by a tour of other creatures that adorn the forest.",480,false,2014-05-02,2018-06-14
33,233373,Santiam Wagon Road - Latiwi Creek to Mountain House,Historic Tour,Explore what early travel was like in the forest on the historic toll road that once linked the Willamette Valley to eastern Oregon. Hike is mostly downhill.,480,false,2014-05-02,2018-06-14
34,233373,Santiam Wagon Road - Enos Road to Clear Lake,Nature Hike,Explore what early travel was like in the forest on the historic toll road that once linked the Willamette Valley to eastern Oregon. Hike is mostly downhill.,0,false,2014-05-02,2020-03-13
35,233373,Art in Nature -  Spring Flowers,Nature Hike,Bring your art supplies and a sense of adventure to have an art filled experience in the great outdoors. ,480,false,2014-05-02,2019-05-16
36,233373,Creativity on the Edge of the Wild,Nature Hike,Bring your art supplies and a sense of adventure to have an art filled experience in the great outdoors.,480,false,2014-05-02,2018-06-14
37,233373,South Pyramid Creek to Shedd Camp Shelter,Historic Tour,Follow in the footsteps of the early packers on the forest as you walk the trails they used.,480,false,2014-05-02,2018-06-14
38,233373,Friends of Fish Lake Tour,Nature Tour,"Walk through Fish Lake Historic site, exploring the legacy of Native Americans, Santiam Wagon Road, and 20th centrury Forest Service including all buildings and equipment from 1920-30s.",480,false,2014-05-02,2018-06-14
39,234787,Guided Walking Tours,Historic Tour,"Plan to spend two hours for this guided tour as a trained volunteer tells the story of the people who lived at the Monument 1,000 years ago. The tour includes both the Pueblo trail and the Great Kiva trail. Guests will see a 44-foot diameter excavated great kiva. Also on this easy trail, theres an excavated pit house, a typical residence of the ancient ones and a sacred archeoastronomy site. The unimproved natural Pueblo trail is 1/2 mile round trip with a 200-foot elevation gain, topping out at 7,600-feet elevation. The Pueblo Trail features a multi-family dwelling and several unexcavated structures. At the top, Chimney Rocks Chacoan-style Great House Pueblo is spectacular against the backdrop of the San Juan Mountains. ",120,true,2014-05-02,2018-06-14
4,233362,Cliff Palace Twilight Tour,Cliff Dwelling Tour,"Photographers, and those who would like to visit the famous Cliff Palace through the historical photographers lens, take this opportunity to spend 90 minutes in Cliff Palace with a park ranger in a small group setting.  On this evening tour, dramatic sunset lighting will appeal to photographers as well as those seeking a deeper connection with this extraordinary archeological treasure. Tripods and all kinds of cameras are welcome. BUT YOU MUST BE ABLE TO CARRY ALL OF YOUR GEAR WHILE KEEPING YOUR HANDS FREE TO CLIMB LADDERS. <br><br>The tour is available daily from May 27th, 2016 to September 5, 2016. Meet the ranger on the overlook above Cliff Palace at least 15 minutes in advance of the tour. Drive time to the Cliff Palace overlook from the park entrance is approximately one hour.",90,false,2014-05-02,2018-06-14
40,234787,Full Moon,Historic Tour,The full moon program takes place against the backdrop of the Great House Pueblo at the top of Chimney Rock Mesa.,180,false,2014-05-02,2018-06-14
400,234787,Autumn Equinox Sunrise Program,Historic Tour,Experience the sunrise from the Chacoan Great House and learn why these events were important to the Ancient Ones.,60,true,2020-02-13,2020-02-13
401,234787,Wildlife of Chimney Rock,Cliff Dwelling Tour,"Southwest Colorado and the Chimney Rock area have a rich abundance of wildlife.  Animals live here and travel through the area on their annual migrations.  Why do animals choose to use this area and what makes it so important to them?  Several species of raptors nest in the Chimney Rock area.  What species are these and where do they nest?   Lynx once roamed the surrounding wilderness.  Can you still find lynx in Colorado and if so, why or why not?  The last grizzly bears in Colorado were killed within sight of Chimney Rock.  The last grizzly succumbed in a battle of life and death between one man and the bear.  What happened, and was she indeed the last?  If these questions arouse a desire to learn more, join us on this 1.5-hour tour.  Stories will be recounted that provide answers to these questions and other narratives of wildlife explored.  We’ll travel through some of these animals’ habitats and learn more about what animals need to survive.  Bring binoculars in the event that we’re lucky enough to see some of these fascinating creatures! The tour requires negotiation of a steep, rough trail with exposure to heights and drop-offs.",90,false,2020-02-21,2020-02-21
402,234787,Flora of Chimney Rock,Cliff Dwelling Tour,"A thousand years ago the people who lived at Chimney Rock depended on the plants around them for food, fuel, tools, housing, clothing, medicine, and art.  The breadth and depth of their knowledge is almost unimaginable today.  Join us for an introduction to some of the plant species that grow at Chimney Rock and their uses by ancestral Puebloan people.  The tour will include the Great House and requires negotiation of a steep, rough trail with exposure to heights and drop-offs.",90,false,2020-02-21,2020-02-21
403,234787,Birding at Chimney Rock,Cliff Dwelling Tour,"Join us for a fun and casual 2-hour bird-walk led by a knowledgeable birding guide from the Weminuche Audubon Society. These outings are designed to introduce you to the diverse community of birds that spend their summer at Chimney Rock National Monument. Birders of all skill levels are welcome to participate. Your guide will help you identify various species and explain the unique adaptations that allow these birds to survive here. Participants will be walking slowly on uneven terrain in the lower area of CRNM (no archaeological sites are included on this tour). Good walking shoes are advised, along with plenty of water and sun protection. Bring binoculars if you have them. Not recommended for young children.",120,false,2020-02-21,2020-02-28
41,234787,Early Tour & Full Moon Package,Combo Tour,This program begins at the upper parking lot with a one-hour guided tour on the 1/3 mile paved Great Kiva Trail loop.,0,false,2014-05-02,2018-06-14
410,234787,Summer Solstice Sunrise Program,Historic Tour,Experience the sunrise from the Chacoan Great House and learn why these events were important to the Ancient Ones.,60,true,2020-02-13,2020-02-13
42,234787,Night Sky: Stars and Galaxies,Historic Tour,"Remote from city lights, enjoy the night sky in a truly dark environment. Your evening begins with a talk at the Visitor Center amphitheater. Topics range from what the ancient people noticed in the night sky to how a telescope helps us see stars and current topics in astronomy. As darkness descends, guests drive to the High Mesa parking lot where volunteer astronomers await with telescopes to provide a closer look at the wonders of the night sky. ",210,true,2014-05-02,2018-06-14
44,234787,Autumnal Equinox,Historic Tour,"Watch the sun rise over the San Juans this first day of autumn, and discuss how the ancients may have lived, and why they celebrated the equinoxes. This 2-3 hour event begins at the Sun Tower, a place not visited on our regular tours, and concludes at the Stone Basin providing two viewing locations.",120,false,2014-05-02,2018-06-14
45,234787,Life at Chimney Rock,Historic Tour,"This free, family-oriented festival is held at Chimney Rocks Visitor Center area. Step back in time as volunteers and artisans demonstrate ancient tools and crafts. ",360,true,2014-05-02,2018-06-14
46,233338,USS Arizona Memorial with Narrated Tour,Combo Tour,"Visitors interested in a fully-narrated tour should choose this option, which includes a ticket for the USS <i>Arizona</i> Memorial program in addition to the audio tour narrated by award-winning actress Jamie Lee Curtis, daughter of actor and Pacific War veteran Tony Curtis.<br><br>The audio tour provides unique interpretation not only throughout USS <i>Arizona</i> Memorial program, but throughout the entire visitor center, including both interpretive exhibit galleries and the waterfront interpretive displays. Featuring guest narration by Pearl Harbor Survivors and National Park Service Historian Daniel Martinez, the audio tour is recommended for all visitors looking for an enhanced experience.<br><br>Audio tour headsets are available for rent at the booth to the left of the NPS Tickets and Information Desk, and the tour is available in seven languages: English, French, Japanese, Korean, Mandarin, German, and Spanish.",0,false,2014-05-02,2018-06-14
