TourID,FacilityID,TourName,TourType,TourDescription,TourDuration,TourAccessible,CreatedDate,LastUpdatedDate
47,233338,Passport to Pearl Harbor,Combo Tour,"The <b>Passport to Pearl Harbor</b> is the most popular tour and allows you to experience all four of the Pearl Harbor Historic destinations at a discounted price. Our Passport to Pearl Harbor is valid for two days within a consecutive seven-days period and includes the <b><a href= http://www.nps.gov/valr> the USS <i>Arizona</i> Memorial Narrated Tour</a></b>, and admission to <b><a href= http://www.bowfin.org> the USS <i>Bowfin</i> Submarine Museum & Park</a></b>, <b><a href= http://www.ussmissouri.com> the Battleship <i>Missouri</i> Memorial</a></b>, and <b><a href= http://www.pacificaviationmuseum.org>Pacific Aviation Museum Pearl Harbor</a></b>.  Reserved Passport to Pearl Harbor tours can be picked up at the National Park Services Ticket Desk.",0,false,2014-05-02,2018-06-14
49,233373,Fall Colors & Seasonal Changes Hike,Nature Hike,Enjoy the impressive fall color display of the Old Cascades.,450,false,2014-05-02,2018-06-14
5,233266,Child Annual Pass,Pass,Child Annual Pass,0,false,2014-05-02,2018-06-14
50,233373,Wildflower Auto Tour - No Walking Necessary,Nature Tour,Explore native wildflowers and the volcanic landscapes that formed the Cascades on a narrated auto tour through the  District.,450,false,2014-05-02,2018-06-14
500,233362,Balcony House,Cliff Dwelling Tour,A tour of Balcony House is one of the most adventurous in the park and not for the faint-of-heart.,60,false,2020-02-13,2020-02-13
501,233362,Long House,Cliff Dwelling Tour,A tour of Long House is one of the most in-depth in the park,120,false,2020-02-13,2020-02-13
502,233362,Cliff Palace,Cliff Dwelling Tour,A tour of Cliff Palace is one of the most awe-inspiring in the park.,60,false,2020-02-13,2020-02-13
51,233373,Echo Basin,Nature Hike,Experience a wildflower-filled meadow in a natural amphitheater and see the largest Alaskan yellow cedars to be found.,480,false,2014-05-02,2018-06-14
52,233373,Gordon Meadows Heritage Hike,Natural and Cultural Hike,"This tour will visit cultural settings including open meadows, ancient trails, old growth trees, and the Edge of the World Site. Tribal practices for the past 8000 years will be discussed.",450,false,2014-05-02,2018-06-14
54,233373,Santiam Wagon Road Hike - Eno Road to Clear Lake,Historic Tour,Explore what early travel was like in the forest on the historic toll road that once linked the Willamette Valley to eastern Oregon.,450,false,2014-05-02,2018-06-14
55,233373,Huckleberry Haven,Nature Hike,Learn about the berries that have sustained people and wildlife in the Cascades for thousands of years. Includes traditional uses of berries and how to distinguish between edible and non-edible.  This is a great hike for families. Please bring a berry container. ,480,false,2014-05-02,2018-06-14
56,233373,Fall Edible Mushrooms,Nature Tour,"Learn about the uses of wild mushrooms, how to distingush between edible and non-edible species.  We will collect edible mushrooms and have a cooking demonstration at Longbow Organizational Camp in the afternoon. Bring a small collecting knife and bags/baskets.",480,false,2014-05-02,2018-06-14
57,233373,Kids Kicking It in the Snow! Snowshoe Trek,Nature Hike,Learn about proper snowshoeing technique and about the winter environment in the Cascades.  This hike is open to families; children 12 and older are welcome with adult supervision.  ,480,false,2014-05-02,2018-06-14
58,233373,Edible Mushroom Hike and Cooking Demonstration,Nature Tour,"Learn about the uses of wild mushrooms, how to distinguish between edible and non-edible species; we will collect edible mushrooms and have a cooking demonstration at Longbow in the afternoon. Bring a small collecting knife and bags/baskets.",360,false,2014-05-02,2018-06-14
59,233373,Santiam Wagon Road - Burnside to Mountian House,Historic Tour,"This hike leave promptly from the ranger district office at scheduled time.  Please come prepared for a day in the forest, lunch, water, appropriate clothes, etc",450,false,2014-05-02,2018-06-14
60,233373,Three Pyramids Wildflower Hike,Nature Hike,A steep but beautiful hike. This 2 mile trail acsends 1600 feet in elevation through old growth forest and meadow before switchbacking to the summit of the Middle Pyramid. Lots of wildflowers and a spectacular view! ,510,false,2014-05-02,2018-06-14
61,233373,Streamside Rock Hounding,Nature Tour,"Enjoy a sunny day on the river, while learning about the origin and identification of our multi-colored river rocks. Requires stable footing for wading up to one mile in the river. Please come prepared for a day on the river, including good footwear for wading, lunch and water. Feel free to bring a rock identification book, a rock hammer and a hand lens.",390,false,2014-05-02,2018-06-14
62,233373,Fall Mushroom Hike - Edibles & Poisonous!,Nature Hike,"The first half of this hike involves learning basic mushroom identification techniques with a focus on distinguishing between edible and non-edible species. Enjoy mushroom collection during the second half. A bucket or basket, and a small cutting knife are recommended. Involve climbing over logs and hiking on rocky trails. Bring waterproof boots.",450,false,2014-05-02,2018-06-14
64,233373,Winter on the Wagon Road Snowshoe Trek,Nature Hike,"Explore what early travel was like in the forest on the historic toll road that once linked the Willamette Valley to eastern Oregon. The exact route will depend on snow conditions.  Conditions can be tough, no novices please.",480,false,2014-05-02,2018-06-14
65,233373,Iron Mountain and Cone Peak Heritage Hike,Historic Tour,"Explore the cultural history, wildflowers, panoramic views and geologic formations that surround these two landmarks. Trail is rocky and uneven in places.",450,false,2014-05-02,2018-06-14
66,233373,Lave Lake,Nature Tour,"Geology, cultural history and botany all await discovery. Explore a scenic, unique and diverse landscape with an 8,000 year old cultural context.",480,false,2014-05-02,2018-06-14
67,233373,Birding in Your Parks Series - Sunnyside County Park,Nature Hike,"Birdwatching for beginners at Park locations.  Learn how to identify birds by sight and sound, along with learning habitat for resident and migratory species.",360,false,2014-05-02,2018-06-14
68,233373,Learn Your Lichens and Mosses,Nature Hike,On this hike participants will learn how to identify common lichen and moss species found in the Cascades and why these organisms are important as environmental indicators.,450,false,2014-05-02,2018-06-14
69,233373,Survival in the Wilderness and Other Places,Nature Tour,Learn skills on how to survive an outdoor emergency in Western Oregon. ,480,false,2014-05-02,2018-06-14
71,234636,Douglass Home Standard Tour,Historic Tour,"Tour the Victorian mansion that was the last residence of famed abolitionist, statesman, and orator, Frederick Douglass",30,true,2014-05-02,2019-02-18
72,234636,Douglass Home Educational Institution/School Group Tour,Historic Tour,"Tour the Victorian mansion that was the last residence of famed abolitionist, statesman, and orator, Frederick Douglass",30,true,2014-05-02,2019-02-18
73,234637,Slaughter Canyon Cave,Cave Tour,"Slaughter Canyon Cave is a strenuous tour.  DO NOT GO TO THE VISITOR CENTER for this tour.  Participants must hike a steep, rocky, and uneven  1/2 mile trail that gains 500 feet in elevation. The tour is slippery, muddy and may require ascent of a 15 foot slope using a knotted rope.  Participants must have a high powered, reliable flashlight with new batteries as this is your only light for the tour.",330,false,2014-05-02,2018-06-14
74,234637,Hall of The White Giant,Cave Tour,"Hall of the White Giant is an extremely strenuous tour. Our most challenging tour, participants must navigate ladders, ropes, and slippery surfaces, bellycrawl for extended periods of time, and free climb rock chimneys.  This tour is not recommended for anyone who has a fear of enclosed spaces, heights, or darkness.",240,false,2014-05-02,2018-06-14
75,234637,Left Hand Tunnel ,Cave Tour,This moderately strenuous adventure tour is a historic lantern lit tour through an undeveloped section of the cave on unpaved trails.,120,false,2014-05-02,2018-06-14
76,234637,Kings Palace,Cave Tour,The Kings Palace tour is a moderately strenuous tour.  There is a steep 80 foot hill you must go down initially and then back up at the end of the tour.,90,false,2014-05-02,2018-06-14
77,234637,Lower Cave,Cave Tour,"Lower Cave is a strenuous tour.  You will descend 10 feet down a flowstone slope by knotted rope and proceed to descend 50 feet down three sets of ladders.  This trip is not recommended for anyone with a fear of enclosed spaces, heights, or darkness.",180,false,2014-05-02,2018-06-14
79,234637,Natural Entrance Self-Guided Tour,Cave Tour,Natural Entrance Self-Guided Tour,120,false,2014-05-02,2018-06-14
80,234637,The Big Room Tour,Cave Tour,The Big Room Tour,90,false,2014-05-02,2018-06-14
89,234639,.,Historic Tour,Independence Hall Tour DO NOT USE,30,true,2014-05-02,2018-06-14
90,234639,Independence Hall,Historic Tour,Independence Hall Tour,30,true,2014-05-02,2018-06-14
91,234640,Star Chamber,Cave Tour,Follow your guide as you retrace along the oldest tour trails and exit the cave into another Star Chamber above the nocturnal Kentucky Landscape.,150,false,2014-05-02,2018-06-14
92,234640,Broadway Tour,Cave Tour,"Large trunk passages, cultural history, visit the underground 1840s hospital.",120,false,2014-05-02,2018-06-14
93,234640,Historic,Cave Tour,"Large trunk passages, oldest tour route and cultural history.",120,false,2014-05-02,2018-06-14
94,234640,Trog,Cave Tour,Connections between the sunlit world and the cave world.,165,false,2014-05-02,2018-06-14
95,234640,Introduction to Caving,Cave Tour,"Safe caving techniques for beginners, natural cave environment and cave exploration suitable for family groups.",210,false,2014-05-02,2018-06-14
96,234640,Wild Cave,Cave Tour,Safe caving techniques and environment concerns and cave exploration.,360,false,2014-05-02,2018-06-14
97,234640,Focus on Frozen Niagara Tour,Cave Tour,Evening tour for amateur photographers.,105,false,2014-05-02,2018-06-14
98,234640,Domes and Dripstones,Cave Tour,"Deep pits, high domes, dry cave passages, dripstone and animal life.",120,false,2014-05-02,2018-06-14
99,234640,Great Onyx Tour,Cave Tour,"Mammoth Cave community life from 1841-1941, geologic beauty by lantern light, cave animals, park surface features.",135,false,2014-05-02,2018-06-14
