RecAreaID,OrgRecAreaID,ParentOrgID,RecAreaName,RecAreaDescription,RecAreaUseFeeDescription,RecAreaDirections,RecAreaPhone,RecAreaEmail,RecAreaReservationURL,RecAreaMapURL,RecAreaLongitude,RecAreaLatitude,StayLimit,Keywords,Reservable,Enabled,LastUpdatedDate,nps_name
2931,SEKI,128,Sequoia & Kings Canyon National Parks,"This dramatic landscape testifies to nature's size, beauty, and diversity—huge mountains, rugged foothills, deep canyons, vast caverns, and the world's largest trees. The parks lie side by side in the southern Sierra Nevada east of the San Joaquin Valley. Weather varies a lot by season and elevation, which ranges from 1,370' to 14,494'.",,"Two highways enter the parks. Hwy 180 from Fresno leads east to Kings Canyon National Park, then continues 30 miles east to Cedar Grove. Hwy 198 from Visalia leads east to Sequoia National Park via Three Rivers. Inside the parks, Highway 198 becomes the Generals Highway, which connects 198 to 180. 

Vehicles over 22-feet long should enter the parks via Highway 180.

In winter, the Generals Highway between the parks often closes. Chains may be required on park roads.

No roads cross these parks east to west.",(559) 565-3341,SEKI_Interpretation@nps.gov,,,-118.587429,36.712773,,"Auto and ATV,Camping,Horse Camping (see also Horse/Stock Use),Climbing,Fishing,Picnicking,Hiking,Horseback Riding,Wildlife Watching,Sequoia & Kings Canyon National Parks",FALSE,TRUE,3/19/20,"['kings canyon', 'sequoia']"
2933,SHEN,128,Shenandoah National Park,"Just 75 miles from the bustle of Washington, D.C., Shenandoah National Park is your escape to recreation and re-creation. Cascading waterfalls, spectacular vistas, quiet wooded hollows—take a hike, meander along Skyline Drive, or picnic with the family. 200,000 acres of protected lands are haven to deer, songbirds, the night sky…and you. Plan a Shenandoah escape today!",,"Shenandoah National Park is located in the Blue Ridge Mountains of Virginia, west of Washington, D.C. It stretches 105 miles and has four entrances: Front Royal (northern entrance), Thornton Gap, Swift Run Gap, and Rockfish Gap (southern entrance to Shenandoah and the northern entrance to the Blue Ridge Parkway). The physical address listed is to the administrative offices, not the park itself. GPS can be unreliable for navigating to the park.",(540) 999-3500,shen_superintendent@nps.gov,,,-78.469077,38.492366,,"Auto and ATV,Camping,Climbing,Fishing,Picnicking,Hiking,Horseback Riding,Wildlife Watching,Shenandoah National Park",FALSE,TRUE,3/19/20,['shenandoah']
2949,THRO,128,Theodore Roosevelt National Park,"When Theodore Roosevelt came to Dakota Territory to hunt bison in 1883, he was a skinny, young, spectacled dude from New York. He could not have imagined how his adventure in this remote and unfamiliar place would forever alter the course of the nation. The rugged landscape and strenuous life that TR experienced here would help shape a conservation policy that we still benefit from today.",,"Theodore Roosevelt National Park is located in the Badlands of western North Dakota. 
There are three units to the park. The South Unit entrance is in the town of Medora, ND off of Interstate 94 exits 24 and 27. The North Unit entrance is on Highway 85 approximately 14 miles south of Watford City, ND. The remote Elkhorn Ranch Unit sits roughly in the middle of the North and South Units and is accessed via gravel roads. Consult park staff for directions to the Elkhorn Ranch Unit.",(701) 623-4466,thro_interpretation@nps.gov,,,-103.430008,47.177773,,"Auto and ATV,Biking,Camping,Horse Camping (see also Horse/Stock Use),Picnicking,Hiking,Horse Camping (see also camping),Wildlife Watching,Theodore Roosevelt National Park",FALSE,TRUE,3/19/20,['theodore roosevelt']
2967,VIIS,128,Virgin Islands National Park,"Virgin Islands National Park is more than just beautiful beaches. Hike to plantation ruins to learn about a time when sugar dominated the island. Visit the ancient petroglyphs carved by the Taino Indians. Come snorkel the coral reefs to discover hidden marine life.  Two-thirds of the island of St. John is national park, making it a unique destination for visitors from around the world.",,"There are no airports on St. John so you must fly to St. Thomas Cyril E. King Airport (code STT) and travel from there.
From the airport you rent a car and drive or take a taxi to Redhook (west end) St. Thomas.
From there you can either take a car barge to St. John or the people ferry.
Once on St. John you can easily walk from the ferry terminal to the Visitor Center.",(340) 776-6201,viis_interpretation@nps.gov,,,-64.741945,18.342797,,"Arts and Culture,Boating,Camping,Fishing,Picnicking,Hiking,Paddling,SCUBA Diving,Snorkeling,Swimming,Wildlife Watching,Virgin Islands National Park",FALSE,TRUE,3/19/20,['virgin islands']
2970,VOYA,128,Voyageurs National Park,"Voyageurs is a maze of interconnected water highways. Plan ahead before coming to this water-based park by bringing your own watercraft, reserving a watercraft, or taking a park ranger boat tour.",,"Voyageurs National Park is located in Northern Minnesota. The park shares its northern boundary with Canada and lies just west of the Boundary Water Canoe Area Wilderness. The park visitor centers are accessible by car but in order to truly experience the park, one must leave their vehicle behind and access the park by boat.",(218) 283-6600,VOYA_Info@nps.gov,,,-92.838291,48.483706,,"Arts and Culture,Biking,Boating,Camping,Fishing,Picnicking,Hiking,Living History,Paddling,Snow Tubing,Swimming,Water Skiing,Wildlife Watching,Voyageurs National Park",FALSE,TRUE,3/19/20,['voyageurs']
2979,WHSA,128,White Sands National Park,"Rising from the heart of the Tularosa Basin is one of the world's great natural wonders - the glistening white sands of New Mexico. Great wave-like dunes of gypsum sand have engulfed 275 square miles of desert, creating the world's largest gypsum dunefield. White Sands National Park preserves a major portion of this unique dunefield, along with the plants and animals that live here.",,White Sands National Park is located off of US Highway 70 between the cities of Las Cruces and Alamogordo. The monument is about 15 miles west of Alamogordo and 52 miles east of Las Cruces.,(575) 479-6124,whsa_interpretation@nps.gov,,,-106.333346,32.779079,,"Auto and ATV,Biking,Camping,Picnicking,Hiking,White Sands National Park",FALSE,TRUE,3/19/20,['white sands']
2980,WICA,128,Wind Cave National Park,"Bison, elk, and other wildlife roam the rolling prairie grasslands and forested hillsides of one of America's oldest national parks. Below the remnant island of intact prairie sits Wind Cave, one of the longest and most complex caves in the world. Named for barometric winds at its entrance, this maze of passages is home to boxwork, a unique formation rarely found elsewhere.",,"Wind Cave National Park is located in South Dakota about 11 miles north of Hot Springs, or about 22 miles south of Custer, on US Highway 385. The park Visitor Center, where all cave tours begin, is approximately 1/2 mile west of the highway.",(605) 745-4600,WICA_interpretation@nps.gov,,,-103.439471,43.580124,,"Auto and ATV,Camping,Picnicking,Hiking,Horseback Riding,Wildlife Watching,Wind Cave National Park",FALSE,TRUE,3/19/20,['wind cave']
2986,WRST,128,Wrangell - St Elias National Park & Preserve,"Wrangell St. Elias is a vast national park that rises from the ocean all the way up to 18,008 ft. At 13.2 million acres, the park is the same size as Yellowstone National Park, Yosemite National Park, and Switzerland combined! Within this wild landscape, people continue to live off the land as they have done for centuries. This rugged, beautiful land is filled with opportunities for adventure.",,"The administrative building and main park visitor center are located along the Richardson Highway (Hwy 4), which is a paved state highway that runs through Copper Center, AK. The buildings are 8 miles south of the Glenn Highway and Richardson Highway intersection near Glennallen, Alaska.  This is approximately 200 miles east of Anchorage, AK and 250 miles south of Fairbanks, AK.",(907) 822-5234,wrst_info@nps.gov,,,-142.602844,61.418215,,"Arts and Culture,Auto and ATV,Biking,Boating,Camping,Climbing,Fishing,Picnicking,Hiking,Hunting,Paddling,Wildlife Watching,Wrangell - St Elias National Park & Preserve",FALSE,TRUE,3/19/20,['wrangell']
2988,YELL,128,Yellowstone National Park,"On March 1, 1872, Yellowstone became the first national park for all to enjoy the unique hydrothermal and geologic wonders. Today, the park hosts millions of visitors annually, from winter visitors exploring wintery snowscapes to summer visitors observing wildlife in an intact ecosystem and watching those same hydrothermal wonders. What are some of your favorite Yellowstone memories?",,"Yellowstone National Park covers nearly 3,500 square miles in the northwest corner of Wyoming (3% of the park is in Montana and 1% is in Idaho). Yellowstone has five entrance stations, and several are closed to regular vehicles during winter. It takes many hours to drive between these entrances, so be sure to check the status of roads at the entrance you intend to use while planning your trip and before you arrive.",(307) 344-7381,yell_visitor_services@nps.gov,,,-110.547169,44.598244,,"Arts and Culture,Auto and ATV,Biking,Boating,Camping,Horse Camping (see also Horse/Stock Use),Fishing,Picnicking,Hiking,Horseback Riding,Paddling,Swimming,Wildlife Watching,Yellowstone National Park",FALSE,TRUE,3/19/20,['yellowstone']
2991,YOSE,128,Yosemite National Park,"Not just a great valley, but a shrine to human foresight, the strength of granite, the power of glaciers, the persistence of life, and the tranquility of the High Sierra.

First protected in 1864, Yosemite National Park is best known for its waterfalls, but within its nearly 1,200 square miles, you can find deep valleys, grand meadows, ancient giant sequoias, a vast wilderness area, and much more.",,"You can drive to Yosemite all year and enter via Highways 41, 140, and 120 from the west. Tioga Pass Entrance (via Highway 120 from the east) is closed from around November through late May or June. Hetch Hetchy is open all year but may close intermittently due to snow.

Please note that GPS units do not always provide accurate directions to or within Yosemite.",(209) 372-0200,yose_web_manager@nps.gov,,,-119.557187,37.848833,,"Arts and Culture,Auto and ATV,Biking,Boating,Camping,Climbing,Fishing,Hiking,Horseback Riding,Living History,Paddling,Snow Tubing,Swimming,Wildlife Watching,Yosemite National Park",FALSE,TRUE,3/19/20,['yosemite']
2994,ZION,128,Zion National Park,"Follow the paths where ancient native people and pioneers walked. Gaze up at massive sandstone cliffs of cream, pink, and red that soar into a brilliant blue sky. Experience wilderness in a narrow slot canyon. Zion’s unique array of plants and animals will enchant you as you absorb the rich history of the past and enjoy the excitement of present day adventures.",,"Zion National Park is located on State Route 9 in Springdale, Utah.",(435) 772-3256,zion_park_information@nps.gov,,,-113.026514,37.298393,,"Biking,Camping,Climbing,Hiking,Wildlife Watching,Zion National Park",FALSE,TRUE,3/19/20,['zion']
,,,,,,,,,,,,,,,,,,
,,,,,,,,,,,,,,,,,,