RecAreaID,OrgRecAreaID,ParentOrgID,RecAreaName,RecAreaDescription,RecAreaUseFeeDescription,RecAreaDirections,RecAreaPhone,RecAreaEmail,RecAreaReservationURL,RecAreaMapURL,RecAreaLongitude,RecAreaLatitude,StayLimit,Keywords,Reservable,Enabled,LastUpdatedDate,nps_name
2738,GRSA,128,Great Sand Dunes National Park & Preserve,"Open all day and night year round, the tallest dunes in North America are the centerpiece in a diverse landscape of grasslands, wetlands, conifer and aspen forests, alpine lakes, and tundra. Experience a starry sky on moonless nights, or a surreal walk on the dunes under bright full moonlight.",,"To access the main park area, including the Dunes Parking Lot, Visitor Center, and Pinyon Flats Campground, take US 160 to CO 150 from the south, or CO 17 to Lane 6 to CO 150 from the west. The national park is at the north end of CO 150.",(719) 378-6395,grsa_interpretation@nps.gov,,,-105.591957,37.792568,,"Arts and Culture,Auto and ATV,Biking,Camping,Horse Camping (see also Horse/Stock Use),Climbing,Fishing,Picnicking,Hiking,Horse Camping (see also camping),Horseback Riding,Hunting,Swimming,Water Skiing,Wildlife Watching,Great Sand Dunes National Park & Preserve",FALSE,TRUE,3/19/20,['great sand dunes']
2739,GRSM,128,Great Smoky Mountains National Park,"Ridge upon ridge of forest straddles the border between North Carolina and Tennessee in Great Smoky Mountains National Park. World renowned for its diversity of plant and animal life, the beauty of its ancient mountains, and the quality of its remnants of Southern Appalachian mountain culture, this is America's most visited national park.",,"Great Smoky Mountains National Park straddles the borders of the states of Tennessee and North Carolina. The three main entrances to the park are in the Gatlinburg, TN; Townsend, TN; and Cherokee, NC.",(865) 436-1200,GRSM_Smokies_Information@nps.gov,,,-83.508183,35.601164,,"Arts and Culture,Auto and ATV,Biking,Camping,Horse Camping (see also Horse/Stock Use),Fishing,Picnicking,Hiking,Horse Camping (see also camping),Horseback Riding,Wildlife Watching,Great Smoky Mountains National Park",FALSE,TRUE,3/19/20,['great smoky mountains']
2744,GUMO,128,Guadalupe Mountains National Park,"Guadalupe Mountains National Park protects the world's most extensive Permian fossil reef, the four highest peaks in Texas, an environmentally diverse collection of flora and fauna, and the stories of lives shaped through conflict, cooperation and survival. Come experience mountains and canyons, desert and dunes, night skies and spectacular vistas within a place unlike any other within the NPS.",,"Guadalupe Mountains National Park is located on the north side of US Hwy 62/180. 
If you are traveling east from El Paso, TX, we are 110 miles East of the city. Follow US Hwy 62/180 North to the Pine Springs Visitor Center. 
If you are traveling from Van Horn, TX, you will travel north on US 54 and make a left hand turn at the junction of US 62/180 to arrive at the park.
If you are traveling west from Carlsbad, NM, you will travel on US Hwy 62/180 South and cross into Texas. Follow signs to the park.",(915) 828-3251,gumo_administration@nps.gov,,,-104.885527,31.923045,,"Auto and ATV,Camping,Horse Camping (see also Horse/Stock Use),Hiking,Horse Camping (see also camping),Horseback Riding,Wildlife Watching,Guadalupe Mountains National Park",FALSE,TRUE,3/19/20,['guadalupe mountains']
2751,HALE,128,Haleakal&#257; National Park,"This special place vibrates with stories of ancient and modern Hawaiian culture and protects the bond between the land and its people. The park also cares for endangered species, some of which exist nowhere else. Come visit this special place - renew your spirit amid stark volcanic landscapes and sub-tropical rain forest with an unforgettable hike through the backcountry.",,"Located on the island of Maui, Haleakalā National Park extends from the 10,023 foot (3055m) summit of Haleakalā down the southeast flank of the mountain to the Kīpahulu coast near Hana. These two sections of the park are not directly connected by road, but both can be reached from Kahului.
There are no gas stations within the park. The last place to get gas in route to the Summit Area is in the town of Pukalani, and along the Hana Highway before Hana is in the town of is in the town of Paia.",(808) 572-4400,hale_interpretation@nps.gov,,,-156.159177,20.70693,,"Camping,Hiking,Swimming,Haleakal&#257; National Park",FALSE,TRUE,3/19/20,[]
2753,HAVO,128,Hawai'i Volcanoes National Park,"Hawai‘i Volcanoes National Park protects some of the most unique geological, biological, and cultural landscapes in the world. Extending from sea level to the summit of Mauna Loa at 13,677 feet, the park encompasses the summits of two of the world's most active volcanoes - Kilauea and Mauna Loa",,"Hawai‘i Volcanoes National Park is located on the island of Hawai‘i. From Hilo: 30 miles southwest on Highway 11 (a 45 minute drive); from Kailua-Kona: 96 miles southeast on Highway 11 (2 to 2 1/2 hour drive), or 125 miles through Waimea and Hilo via highways 19 and 11 (2 1/2 to 3 hours).",(808) 985-6101,havo_information@nps.gov,,,-155.470026,19.335504,,"Arts and Culture,Biking,Camping,Hiking,Living History,Wildlife Watching,Hawai'i Volcanoes National Park",FALSE,TRUE,3/19/20,[]
2760,HOSP,128,Hot Springs National Park,"Water. That's what first attracted people, and they have been coming here ever since to use these soothing thermal waters to heal and relax. Rich and poor alike came for the baths, and a thriving city built up around the hot springs. Together nicknamed ""The American Spa,"" Hot Springs National Park today surrounds the north end of the city of Hot Springs, Arkansas. Come discover it for yourself.",,"Hot Springs National Park is a 5,500 acre park in the city of Hot Springs.  Bathhouse Row, a quarter mile long collection of eight bathhouses along the east side of Central Avenue, is the most visited area within the national park. The Fordyce Bathhouse operates as a visitor center and a museum.",(501) 620-6715,hosp_park_interpretation@nps.gov,,,-93.063329,34.524144,,"Camping,Hiking,Hot Springs National Park",FALSE,TRUE,3/19/20,['hot springs']
2767,INDU,128,Indiana Dunes National Park,"Indiana Dunes National Park hugs 15 miles of the southern shore of Lake Michigan and has much to offer. Whether you enjoy scouting for rare species of birds or flying kites on the sandy beach, the national park's 15,000 acres will continually enchant you.  Hikers will enjoy 50 miles of trails over rugged dunes, mysterious wetlands, sunny prairies, meandering rivers and peaceful forests.",,"Visitors can access the national park via Interstate 94, the Indiana Toll Road (Interstate 80/90), U.S. Highway 12, U.S. Highway 20, Indiana State Road 49, and various other local roads. The Indiana Dunes Visitor Center is located on Indiana State Road 49, between U.S. Highway 20 and Interstate 94 (1215 North State Road 49, Porter, IN 46304). For a driving map to the Indiana Dunes Visitor Center or other locations, check out our maps page.",(219) 395-1882,indu_communications@nps.gov,,,-87.096474,41.637655,,"Arts and Culture,Auto and ATV,Biking,Boating,Camping,Fishing,Picnicking,Hiking,Paddling,Swimming,Wildlife Watching,Indiana Dunes National Park",FALSE,TRUE,3/19/20,['indiana dunes']
2769,ISRO,128,Isle Royale National Park,"Explore a rugged, isolated island, far from the sights and sounds of civilization. Surrounded by Lake Superior, Isle Royale offers unparalleled solitude and adventures for backpackers, hikers, boaters, kayakers, canoeists and scuba divers. Here, amid stunning scenic beauty, you'll find opportunities for reflection and discovery, and make memories that last a lifetime.",,"Isle Royale National Park headquarters is located in Houghton, MI.  Visit the Houghton page on the Isle Royale National Park website for additional information and a map on how to access the visitor center.",(906) 482-0984,isro_parkinfo@nps.gov,,,-88.827807,48.011458,,"Arts and Culture,Boating,Camping,Fishing,Hiking,Paddling,SCUBA Diving,Wildlife Watching,Isle Royale National Park",FALSE,TRUE,3/19/20,['isle royale']
2782,JOTR,128,Joshua Tree National Park,"Two distinct desert ecosystems, the Mojave and the Colorado, come together in Joshua Tree National Park. A fascinating variety of plants and animals make their homes in a land sculpted by strong winds and occasional torrents of rain. Dark night skies, a rich cultural history, and surreal geologic features add to the wonder of this vast wilderness in southern California. Come explore for yourself.",,"From I-10, take exit 117 for CA Hwy 62 toward 29 Palms/Yucca Valley. This will allow you to access the West Entrance, the North Entrance, Black Rock, and Indian Cove.

Take exit 168 off I-10 to come in at the park's South Entrance.",(760) 367-5500,jotr_info@nps.gov,,,-115.839812,33.914185,,"Auto and ATV,Biking,Camping,Horse Camping (see also Horse/Stock Use),Climbing,Picnicking,Hiking,Horse Camping (see also camping),Horseback Riding,Wildlife Watching,Joshua Tree National Park",FALSE,TRUE,3/19/20,['joshua tree']
2786,KATM,128,Katmai National Park & Preserve,"A landscape is alive underneath our feet, filled with creatures that remind us what it is to be wild.

Katmai was established in 1918 to protect the volcanically devastated region surrounding Novarupta and the Valley of Ten Thousand Smokes. Today, Katmai National Park and Preserve also protects 9,000 years of human history and important habitat for salmon and thousands of brown bears.",,"Katmai National Park & Preserve is located on the northern Alaska Peninsula, northwest of Kodiak Island and southwest of Homer, Alaska. The park’s headquarters is in King Salmon, about 290 air miles southwest of Anchorage. Unlike most national parks in the United States, Katmai is almost exclusively accessed by plane or boat.",(907) 246-3305,KATM_Visitor_Information@nps.gov,,,-155.012657,58.622357,,"Boating,Camping,Fishing,Hiking,Paddling,Wildlife Watching,Katmai National Park & Preserve",FALSE,TRUE,3/19/20,['katmai']
2787,KEFJ,128,Kenai Fjords National Park,"At the edge of the Kenai Peninsula lies a land where the ice age lingers. Nearly 40 glaciers flow from the Harding Icefield, Kenai Fjords' crowning feature. Wildlife thrives in icy waters and lush forests around this vast expanse of ice. Sugpiaq people relied on these resources to nurture a life entwined with the sea. Today, shrinking glaciers bear witness to the effects of our changing climate.",,"Kenai Fjords National Park is located just outside the town of Seward in south-central Alaska, 126 miles south of Anchorage. Even though the park is often inaccessible during the winter months, Seward is accessible year-round via the Seward Highway, a National Scenic Byway.

Follow the Seward Highway (AK-1) south from Anchorage. It will become AK-9 around mile 35 (87 miles from Anchorage) with AK-1 heading to Homer and Kenai. Continue on AK-9 to Seward.",(907) 422-0500,kefjinformation@nps.gov,,,-150.106502,59.818044,,"Boating,Camping,Climbing,Fishing,Hiking,Paddling,Wildlife Watching,Kenai Fjords National Park",FALSE,TRUE,3/19/20,['kenai fjords']
2795,KOVA,128,Kobuk Valley National Park,"Caribou, sand dunes, the Kobuk River, Onion Portage - just some of the facets of Kobuk Valley National Park. Half a million caribou migrate through, their tracks crisscrossing sculpted dunes. The Kobuk River is an ancient and current path for people and wildlife. For 9000 years, people came to Onion Portage to harvest caribou as they swam the river. Even today, that rich tradition continues.",,"Kobuk Valley National Park is very remote. There are no roads to provide access, so planes take care of most transportation needs.  Commercial airlines provide service from Anchorage to Kotzebue, or from Fairbanks to Bettles. Once in Kotzebue or Bettles, you must fly to the park with authorized air taxis.",(907) 442-3890,wear_webmail@nps.gov,,,-159.200229,67.356313,,"Boating,Camping,Fishing,Hiking,Paddling,Wildlife Watching,Kobuk Valley National Park",FALSE,TRUE,3/19/20,['kobuk valley']
2799,LACL,128,Lake Clark National Park & Preserve,"Lake Clark National Park and Preserve is a land of stunning beauty. Volcanoes steam, salmon run, bears forage, and craggy mountains reflect in shimmering turquoise lakes. Here, too, local people and culture still depend on the land and water. Venture into the park to become part of the wilderness.",,"Lake Clark is located on the Alaska Peninsula southwest of Anchorage and north of Katmai National Park. It is not on the road system; therefore, in order to get here you must travel either via plane or by boat. A one to two-hour flight from Anchorage, Kenai, or Homer will provide access to most points within Lake Clark. Fixed-wing aircraft are allowed to land on all suitable lakes, rivers, beaches, gravel bars, and open ground in both the park and preserve unless the area is closed or otherwise restricted.",(907) 644-3626,lacl_visitor_information@nps.gov,,,-153.55535,60.574059,,"Biking,Boating,Camping,Climbing,Fishing,Hiking,Hunting,Paddling,Wildlife Watching,Lake Clark National Park & Preserve",FALSE,TRUE,3/19/20,['lake clark']
2803,LAVO,128,Lassen Volcanic National Park,"Lassen Volcanic National Park is home to steaming fumaroles, meadows freckled with wildflowers, clear mountain lakes, and numerous volcanoes. Jagged peaks tell the story of its eruptive past while hot water continues to shape the land. Lassen Volcanic offers opportunities to discover the wonder and mysteries of volcanoes and hot water for visitors willing to explore the undiscovered.",,"From Interstate 5 (Redding), take Hwy 44 - 48 miles east to the junction of Hwy 89. Follow Hwy 89 south 1 mile to the north entrance of the park. From Interstate 5 (Red Bluff) take Hwy 36 E - 51 miles east to the junction of Hwy 89. Follow Hwy 89 north 6 miles to south entrance of the park.",(530) 595-4480,lavo_information@nps.gov,,,-121.407599,40.493546,,"Auto and ATV,Boating,Camping,Horse Camping (see also Horse/Stock Use),Fishing,Hiking,Horseback Riding,Paddling,Swimming,Wildlife Watching,Lassen Volcanic National Park",FALSE,TRUE,3/19/20,['lassen volcanic']
2818,MACA,128,Mammoth Cave National Park,"Mammoth Cave National Park preserves not only the longest known cave system on earth (400+ miles), but also 53,000 acres of beautiful forest.  With nearly a dozen miles of cave trail below ground, there are also nearly 70 miles of surface trail, 13 backcountry campsites, three campgrounds, and over 20 miles of navigable river for visitors to explore and enjoy. It really is two worlds in one.",,"DO NOT FOLLOW YOUR GPS!

From the North: Take Interstate 65 to Exit 53 (Cave City Exit). Turn right onto KY-70. Follow 70/255 as it becomes the Mammoth Cave Parkway in the park. Follow the Mammoth Cave Parkway to the Visitor Center.

From the South: Take Interstate 65 to Exit 48 (Park City Exit). Turn left onto KY-255 and follow 255 as it becomes the Park City Road into the park. Follow Park City Road until it joins the Mammoth Cave Parkway; turn left. Follow the Mammoth Cave Parkway to the Visitor Center.",(270) 758-2180,maca_information@nps.gov,,,-86.130902,37.197605,,"Biking,Camping,Horse Camping (see also Horse/Stock Use),Fishing,Hiking,Horse Camping (see also camping),Horseback Riding,Paddling,Swimming,Mammoth Cave National Park",FALSE,TRUE,3/19/20,['mammoth cave']
2824,MEVE,128,Mesa Verde National Park,"Mesa Verde National Park was established in 1906 to preserve and interpret the archeological heritage of the Ancestral Pueblo people who made it their home for over 700 years, from 600 to 1300 CE. Today, the park protects nearly 5,000 known archeological sites, including 600 cliff dwellings. These sites are some of the most notable and best preserved in the United States.",,"Mesa Verde National Park is in Southwestern Colorado. The park entrance is along Highway 160, between the towns of of Cortez and Mancos, Colorado. (10 miles east of Cortez; 9 miles west of Mancos; and about 35 miles west of Durango, Colorado.)

Once you enter the park, the first view of a cliff dwelling is 21 miles (approximately 45 minutes) along a steep, narrow, and winding road.",(970) 529-4465,meve_general_information@nps.gov,,,-108.462403,37.239083,,"Camping,Hiking,Wildlife Watching,Mesa Verde National Park",FALSE,TRUE,3/19/20,['mesa verde']
2835,MORA,128,Mount Rainier National Park,"Ascending to 14,410 feet above sea level, Mount Rainier stands as an icon in the Washington landscape. An active volcano, Mount Rainier is the most glaciated peak in the contiguous U.S.A., spawning five major rivers. Subalpine wildflower meadows ring the icy volcano while ancient forest cloaks Mount Rainier’s lower slopes. Wildlife abounds in the park’s ecosystems. A lifetime of discovery awaits.",,"Mount Rainier National Park is located in west-central Washington state. Several major cities in Washington- Seattle, Tacoma, and Yakima- and Portland, Oregon, are within 200 miles of the park. For GPS to Nisqually Entrance use: 39000 State Route 706 E, Ashford, WA 98304.",(360) 569-2211,morainfo@nps.gov,,,-121.704388,46.860754,,"Auto and ATV,Biking,Camping,Climbing,Fishing,Hiking,Living History,Wildlife Watching,Mount Rainier National Park",FALSE,TRUE,3/19/20,['mount rainier']
2845,NOCA,128,North Cascades National Park,"Less than three hours from Seattle, an alpine landscape beckons. Discover communities of life adapted to moisture in the west and recurring fire in the east. Explore jagged peaks crowned by more than 300 glaciers. Listen to cascading waters in forested valleys. Witness a landscape sensitive to the Earth's changing climate. Help steward the ecological heart of the Cascades.",,"Access to North Cascades National Park and Ross Lake National Recreation Area is from the State Route 20 corridor. SR 20 (North Cascades Highway) connects with Interstate 5 (Exit 230) at Burlington. From the east, the highway intersects with US 97 at Okanogan and with SR 153 at Twisp. The State Department of Transportation closes a portion of the road between Ross Dam Trailhead and Lone Fir Campground in winter. The Lake Chelan National Recreation Area (Stehekin) is accessible by ferry or plane from Chelan.",(360) 854-7200,noca_interpretation@nps.gov,,,-121.206942,48.711718,,"Auto and ATV,Biking,Boating,Camping,Horse Camping (see also Horse/Stock Use),Climbing,Fishing,Hiking,Horseback Riding,Paddling,North Cascades National Park",FALSE,TRUE,3/19/20,['north cascades']
2847,NPSA,128,National Park of American Samoa,"The National Park of American Samoa welcomes you into the heart of the South Pacific, to a world of sights, sounds, and experiences that you will find in no other national park in the United States. 

Enjoy this unique national park and the welcoming people of American Samoa. We are here to protect its rich culture and natural resources. Come explore them with us!",,"The visitor center is located in the village of Pago Pago, across from the Pago Way Service Station. The national park is located in the villages of Vatia, Pago Pago, Fagasa, Afono (on Tutuila Island), Fitiuta, Faleasao (on Ta'u Island), and Ofu Island",(684) 633-7082,npsa_info@nps.gov,,,-169.850378,-14.228659,,"Arts and Culture,Hiking,Living History,SCUBA Diving,Snorkeling,Swimming,Wildlife Watching,National Park of American Samoa",FALSE,TRUE,3/19/20,['american samoa']
2856,PEFO,128,Petrified Forest National Park,"Did you know that Petrified Forest is more spectacular than ever? While the park has all the wonders known for a century, there are many new adventures and discoveries to share. There are backcountry hikes into areas never open before such as Red Basin and little known areas like the Martha's Butte. There are new exhibits that bring the stories to life. Come rediscover Petrified Forest!",,"Usually you can drive through the park to connect I-40 with Hwy 180. There is a Federal Highways Administration Road and Bridge Rehabilitation Project right now that creates a closure at the middle of the park road. Estimated Project Time: January 2nd through May 9th, 2020. For more information on this project and subsequent road closures please visit  <a href=""https://www.nps.gov/pefo/planyourvisit/road-closures.htm"">https://www.nps.gov/pefo/planyourvisit/road-closures.htm</a>",(928) 524-6228,PEFO_Superintendent@nps.gov,,,-109.787768,34.983877,,"Arts and Culture,Auto and ATV,Biking,Camping,Horse Camping (see also Horse/Stock Use),Picnicking,Hiking,Horse Camping (see also camping),Horseback Riding,Wildlife Watching,Petrified Forest National Park",FALSE,TRUE,3/19/20,['petrified forest']
2881,OLYM,128,Olympic National Park,"With its incredible range of precipitation and elevation, diversity is the hallmark of Olympic National Park. Encompassing nearly a million acres, the park protects a vast wilderness, thousands of years of human history, and several distinctly different ecosystems, including glacier-capped mountains, old-growth temperate rain forests, and over 70 miles of wild coastline. Come explore!",,"You can reach Olympic National Park via the I-5 corridor or by any one of the quieter state roadways. Once you arrive on the Olympic Peninsula connect to Hwy 101 to reach any destinations in and around Olympic National Park.
From Olympia: take I-5 to Hwy 101
From Tacoma: take State Route 16 to Bremerton; take State Route 3 north from Bremerton to State Route 104.
From Washington/Oregon Coast connect to Hwy 101 in Aberdeen.",(360) 565-3130,olym_visitor_center@nps.gov,,,-123.666385,47.803928,,"Boating,Camping,Horse Camping (see also Horse/Stock Use),Climbing,Fishing,Picnicking,Hiking,Horse Camping (see also camping),Paddling,Swimming,Wildlife Watching,Olympic National Park",FALSE,TRUE,3/19/20,['olympic']
2893,PINN,128,Pinnacles National Park,"Some 23 million years ago multiple volcanoes erupted, flowed, and slid to form what would become Pinnacles National Park. What remains is a unique landscape. Travelers journey through chaparral, oak woodlands, and canyon bottoms. Hikers enter rare talus caves and emerge to towering rock spires teeming with life: prairie and peregrine falcons, golden eagles, and the inspiring California condor.",,"Pinnacles National Park is accessible through highway 101 for the West entrance, and highway 25 for the East entrance. From highway 101 you must pass through the City of Soledad to find highway 146 which will lead to West side of Pinnacles. To enter East Pinnacles you must find highway 25 through the City of Hollister coming from the North, and King City through Bitter Water Road (G-13) when coming from the South.",(831) 389-4486,pinn_visitor_information@nps.gov,,,-121.181361,36.490292,,"Camping,Climbing,Picnicking,Hiking,Wildlife Watching,Pinnacles National Park",FALSE,TRUE,3/19/20,['pinnacles']
2907,ROMO,128,Rocky Mountain National Park,"Rocky Mountain National Park’s 415 square miles encompass and protect spectacular mountain environments. Enjoy Trail Ridge Road – which crests at over 12,000 feet including many overlooks to experience the subalpine and alpine worlds – along with over 300 miles of hiking trails, wildflowers, wildlife, starry nights, and fun times. In a world of superlatives, Rocky is on top!",,"Driving from the east: from I-25, take US Hwy 34 or 36. Driving from the west: from I-70, take US Hwy 40 to Granby to US Hwy 34 to Grand Lake. From mid-October until late May, Trail Ridge Road between Estes Park and Grand Lake is closed to vehicles, so driving between the two takes ~4 hours. The closest airport is Denver International (DIA). There is no public transportation between nearby cities and the park.",(970) 586-1206,romo_information@nps.gov,,,-105.697288,40.355692,,"Arts and Culture,Auto and ATV,Biking,Camping,Climbing,Fishing,Picnicking,Hiking,Horseback Riding,Snow Tubing,Wildlife Watching,Rocky Mountain National Park",FALSE,TRUE,3/19/20,['rocky mountain']
2917,SAGU,128,Saguaro National Park,"Tucson, Arizona is home to the nation's largest cacti. The giant saguaro is the universal symbol of the American west. These majestic plants, found only in a small portion of the United States, are protected by Saguaro National Park, to the east and west of the modern city of Tucson. Here you have a chance to see these enormous cacti, silhouetted by the beauty of a magnificent desert sunset.",,"Saguaro National Park has two districts separated by the city of Tucson.  We do not recommend using mobile mapping applications to search for either district.  Instead, please click the link to the directions page, determine which district you plan to visit, and enter that physical address into the mobile application.",(520) 733-5153,sagu_information@nps.gov,,,-110.757497,32.209096,,"Arts and Culture,Auto and ATV,Biking,Camping,Hiking,Saguaro National Park",FALSE,TRUE,3/19/20,['saguaro']
